{
 "version": "0.19.0",
 "generated": "2026-10-11",
 "plays_snapshot": "2026-10-11",
 "method": "Era deep-dives expanded from data/v1/transmission.json against data/artist.json (discography), data/v1/years.json, data/sessions.json, data/v1/circle.json, and data/v1/codex.json. collaborators[] holds EVERY in-era collaborator (transmission.json keeps only the top 3). summary figures are recomputed and asserted in scripts/build_eras.py. Titles and metadata only - never lyrics, never invented bio facts.",
 "archive_totals": {
  "transmissions": 220,
  "plays": 257394,
  "sessions": 64,
  "years": [
   "2018",
   "2019",
   "2020",
   "2021",
   "2022",
   "2023",
   "2024",
   "2025",
   "2026"
  ]
 },
 "eras": [
  {
   "id": "the-first-rite",
   "name": "The First Rite",
   "span": "2017 – 2019",
   "years": [
    "2018",
    "2019"
   ],
   "scene": "The first casting: a guest verse in 2017, then the WoT seal pressed onto Master Key.",
   "note": "WoT label era; earliest trace is a 2017 feature credit on another artist's single.",
   "era_releases": [
    "lost memories (feat. Aster Da Master)",
    "Contact!",
    "Master Key (feat. Lil Wintr & Marcelo)",
    "Master Key",
    "Soulless Soldiers"
   ],
   "transmissions": 80,
   "plays": 220688,
   "sessions": 29,
   "distributor": 5,
   "top_tracks": [
    {
     "title": "Take Me (prod. Em Klebold)",
     "plays": 30088,
     "date": "2018-02-04",
     "page": "releases/take-me-prod-em-klebold.html"
    },
    {
     "title": "Soul Shaking (prod. Fish Narc)",
     "plays": 12944,
     "date": "2018-01-03",
     "page": "releases/soul-shaking-prod-fish-narc.html"
    },
    {
     "title": "candy w/ capoxxo(prod. razorwrist)",
     "plays": 11587,
     "date": "2019-10-04",
     "page": "releases/candy-w-capoxxo-prod-razorwrist.html"
    }
   ],
   "key_sessions": [
    {
     "name": "The February 4th Session",
     "track_count": 1,
     "total_plays": 30088,
     "days": 1,
     "start": "2018-02-04",
     "end": "2018-02-04",
     "deep_dive": null
    },
    {
     "name": "The December 22nd Session",
     "track_count": 7,
     "total_plays": 21777,
     "days": 1,
     "start": "2019-12-22",
     "end": "2019-12-22",
     "deep_dive": "sessions/the-december-22nd-session.html"
    },
    {
     "name": "The December 30th Session",
     "track_count": 6,
     "total_plays": 16172,
     "days": 1,
     "start": "2019-12-30",
     "end": "2019-12-30",
     "deep_dive": "sessions/the-december-30th-session.html"
    }
   ],
   "collaborators": [
    {
     "name": "Yung Vetta",
     "transmissions": 7,
     "plays": 17893,
     "page": "circle/index.html#c-yung-vetta"
    },
    {
     "name": "capoxxo",
     "transmissions": 2,
     "plays": 16174,
     "page": "circle/index.html#c-capoxxo"
    },
    {
     "name": "JAX",
     "transmissions": 3,
     "plays": 12783,
     "page": "circle/index.html#c-jax"
    },
    {
     "name": "Max Ferrari",
     "transmissions": 2,
     "plays": 12083,
     "page": "circle/index.html#c-max-ferrari"
    },
    {
     "name": "Lil Wintr",
     "transmissions": 2,
     "plays": 9615,
     "page": "circle/index.html#c-lil-wintr"
    },
    {
     "name": "Marcelo",
     "transmissions": 2,
     "plays": 9615,
     "page": "circle/index.html#c-marcelo"
    },
    {
     "name": "pvscale",
     "transmissions": 1,
     "plays": 7786,
     "page": "circle/index.html#c-pvscale"
    },
    {
     "name": "LILVICBXI",
     "transmissions": 2,
     "plays": 4570,
     "page": "circle/index.html#c-lilvicbxi"
    },
    {
     "name": "JO$E DRIPP",
     "transmissions": 2,
     "plays": 3171,
     "page": "circle/index.html#c-jo-e-dripp"
    },
    {
     "name": "lil soda boi",
     "transmissions": 1,
     "plays": 3075,
     "page": "circle/index.html#c-lil-soda-boi"
    },
    {
     "name": "Keyblayde808",
     "transmissions": 1,
     "plays": 2650,
     "page": "circle/index.html#c-keyblayde808"
    },
    {
     "name": "AMMI $AGE",
     "transmissions": 1,
     "plays": 2490,
     "page": "circle/index.html#c-ammi-age"
    },
    {
     "name": "Shola",
     "transmissions": 1,
     "plays": 1443,
     "page": "circle/index.html#c-shola"
    },
    {
     "name": "lil yu",
     "transmissions": 1,
     "plays": 1343,
     "page": "circle/index.html#c-lil-yu"
    },
    {
     "name": "Offline_hp",
     "transmissions": 1,
     "plays": 1311,
     "page": "circle/index.html#c-offline-hp"
    },
    {
     "name": "Yung Cortex",
     "transmissions": 1,
     "plays": 1115,
     "page": "circle/index.html#c-yung-cortex"
    }
   ],
   "milestones": [
    {
     "id": "first-distributor",
     "name": "First distributor transmission",
     "date": "2017-04-20",
     "title": "lost memories (feat. Aster Da Master)",
     "fact": "The catalog's first appearance on streaming platforms: as a featured artist, two years before the first vault upload."
    },
    {
     "id": "first-vault",
     "name": "First vault transmission",
     "date": "2018-01-03",
     "title": "Soul Shaking (prod. Fish Narc)",
     "fact": "The first upload to the official SoundCloud, and it arrived already carrying five figures of plays. The opening shot was not a warm-up."
    },
    {
     "id": "first-collab",
     "name": "First collaboration",
     "date": "2018-04-28",
     "title": "Mistakes Ft. JO$E DRIPP (prod. Tec)",
     "fact": "The first transmission to summon another voice. The circle starts here and grows to twenty-one collaborators."
    }
   ],
   "signal": "80 transmissions, 220,688 plays: 85.7% of every play in the archive. Two years carried the whole catalog.",
   "tracks": [
    {
     "ordinal": 0,
     "title": "Master Key",
     "date": "2019-12-23",
     "type": "Album",
     "plays": null,
     "page": "releases/master-key.html"
    },
    {
     "ordinal": 1,
     "title": "Soulless Soldiers",
     "date": "2019-12-30",
     "type": "Album",
     "plays": null,
     "page": "releases/soulless-soldiers.html"
    },
    {
     "ordinal": 10,
     "title": "Gravestone",
     "date": "2018-04-27",
     "type": "Single",
     "plays": null,
     "page": "releases/gravestone.html"
    },
    {
     "ordinal": 11,
     "title": "Contact!",
     "date": "2019-09-21",
     "type": "Single",
     "plays": null,
     "page": "releases/contact.html"
    },
    {
     "ordinal": 12,
     "title": "Master Key (feat. Lil Wintr & Marcelo)",
     "date": "2019-12-06",
     "type": "Single",
     "plays": null,
     "page": "releases/master-key-feat-lil-wintr-and-marcelo.html"
    },
    {
     "ordinal": 146,
     "title": "Best Friend ft. lil soda boi (prod. lil soda boi)",
     "date": "2019-12-30",
     "type": "SoundCloud-only",
     "plays": 3075,
     "page": "releases/best-friend-ft-lil-soda-boi-prod-lil-soda-boi.html"
    },
    {
     "ordinal": 147,
     "title": "Costs Of Life (prod. aster)",
     "date": "2019-12-30",
     "type": "SoundCloud-only",
     "plays": 2721,
     "page": "releases/costs-of-life-prod-aster.html"
    },
    {
     "ordinal": 148,
     "title": "Soulless Soldiers (prod. Born Hero)",
     "date": "2019-12-30",
     "type": "SoundCloud-only",
     "plays": 5878,
     "page": "releases/soulless-soldiers-prod-born-hero.html"
    },
    {
     "ordinal": 149,
     "title": "All Alone ft. Yung Cortex (prod. Yung Cortex)",
     "date": "2019-12-30",
     "type": "SoundCloud-only",
     "plays": 1115,
     "page": "releases/all-alone-ft-yung-cortex-prod-yung-cortex.html"
    },
    {
     "ordinal": 150,
     "title": "Pavement (prod. Fish Narc)",
     "date": "2019-12-30",
     "type": "SoundCloud-only",
     "plays": 733,
     "page": "releases/pavement-prod-fish-narc.html"
    },
    {
     "ordinal": 151,
     "title": "White Noise ft. Keyblayde808 (prod. Keyblayde808)",
     "date": "2019-12-30",
     "type": "SoundCloud-only",
     "plays": 2650,
     "page": "releases/white-noise-ft-keyblayde808-prod-keyblayde808.html"
    },
    {
     "ordinal": 152,
     "title": "getting colder w/ capoxxo (prod. pvscale x asa41)",
     "date": "2019-12-22",
     "type": "SoundCloud-only",
     "plays": 4587,
     "page": "releases/getting-colder-w-capoxxo-prod-pvscale-x-asa41.html"
    },
    {
     "ordinal": 153,
     "title": "I'd rather be w/ lil yu (prod. razorwrist)",
     "date": "2019-12-22",
     "type": "SoundCloud-only",
     "plays": 1343,
     "page": "releases/i-d-rather-be-w-lil-yu-prod-razorwrist.html"
    },
    {
     "ordinal": 154,
     "title": "snow caps w/ LILVICBXI (prod. LILVICBXI x spliff08_)",
     "date": "2019-12-22",
     "type": "SoundCloud-only",
     "plays": 1579,
     "page": "releases/snow-caps-w-lilvicbxi-prod-lilvicbxi-x-spliff08.html"
    },
    {
     "ordinal": 155,
     "title": "my friends (prod. deephartt)",
     "date": "2019-12-22",
     "type": "SoundCloud-only",
     "plays": 1582,
     "page": "releases/my-friends-prod-deephartt.html"
    },
    {
     "ordinal": 156,
     "title": "fly like me w/ pvscale(prod. pvscale)",
     "date": "2019-12-22",
     "type": "SoundCloud-only",
     "plays": 7786,
     "page": "releases/fly-like-me-w-pvscale-prod-pvscale.html"
    },
    {
     "ordinal": 157,
     "title": "same amount w/ LILVICBXI (prod. LILVICBXI)",
     "date": "2019-12-22",
     "type": "SoundCloud-only",
     "plays": 2991,
     "page": "releases/same-amount-w-lilvicbxi-prod-lilvicbxi.html"
    },
    {
     "ordinal": 158,
     "title": "attempt to be (prod. uniquate)",
     "date": "2019-12-22",
     "type": "SoundCloud-only",
     "plays": 1909,
     "page": "releases/attempt-to-be-prod-uniquate.html"
    },
    {
     "ordinal": 159,
     "title": "master key ft. Lil Wintr x Marcelo (prod. ginseng)",
     "date": "2019-12-06",
     "type": "SoundCloud-only",
     "plays": 9615,
     "page": "releases/master-key-ft-lil-wintr-x-marcelo-prod-ginseng.html"
    },
    {
     "ordinal": 160,
     "title": "candy w/ capoxxo(prod. razorwrist)",